{"$schema":"urn:aseos:schema:planned-contract-inventory:1.0.0","inventoryVersion":"1.0.0","baselineCommit":"f4f10855f5bfcce2d56ff4b110f271b4d7cfd116","status":"PLANNED","contracts":[{"contractId":"aseos.configuration.effective-config-snapshot","canonicalName":"EffectiveConfigSnapshot","domain":"configuration","canonicalOwner":"packages/platform","contractKind":"JSON_SCHEMA","priority":"P1","phaseIntroduced":"PHASE_1","authorityPath":"packages/contracts/schemas/configuration/effective-config-snapshot.schema.json","adrRefs":[]},{"contractId":"aseos.configuration.framework-config","canonicalName":"FrameworkConfig","domain":"configuration","canonicalOwner":"packages/platform","contractKind":"JSON_SCHEMA","priority":"P1","phaseIntroduced":"PHASE_1","authorityPath":"packages/contracts/schemas/configuration/framework-config.schema.json","adrRefs":[]},{"contractId":"aseos.context.context-item","canonicalName":"ContextItem","domain":"context","canonicalOwner":"packages/context","contractKind":"JSON_SCHEMA","priority":"P3","phaseIntroduced":"PHASE_3","authorityPath":"packages/contracts/schemas/context/context-item.schema.json","adrRefs":[]},{"contractId":"aseos.context.context-policy","canonicalName":"ContextPolicy","domain":"context","canonicalOwner":"packages/context","contractKind":"JSON_SCHEMA","priority":"P3","phaseIntroduced":"PHASE_3","authorityPath":"packages/contracts/schemas/context/context-policy.schema.json","adrRefs":["ADR-0011"]},{"contractId":"aseos.context.context-snapshot","canonicalName":"ContextSnapshot","domain":"context","canonicalOwner":"packages/context","contractKind":"JSON_SCHEMA","priority":"P3","phaseIntroduced":"PHASE_3","authorityPath":"packages/contracts/schemas/context/context-snapshot.schema.json","adrRefs":[]},{"contractId":"aseos.control-api.control-api-problem","canonicalName":"ControlApiProblem","domain":"control-api","canonicalOwner":"packages/contracts","contractKind":"JSON_SCHEMA","priority":"P1","phaseIntroduced":"PHASE_1","authorityPath":"packages/contracts/schemas/control-api/control-api-problem.schema.json","adrRefs":["ADR-0009"]},{"contractId":"aseos.control-api.control-endpoint-descriptor","canonicalName":"ControlEndpointDescriptor","domain":"control-api","canonicalOwner":"packages/platform","contractKind":"JSON_SCHEMA","priority":"P1","phaseIntroduced":"PHASE_1","authorityPath":"packages/contracts/schemas/control-api/control-endpoint-descriptor.schema.json","adrRefs":["ADR-0009"]},{"contractId":"aseos.control-api.control-event-notification","canonicalName":"ControlEventNotification","domain":"control-api","canonicalOwner":"packages/platform","contractKind":"JSON_SCHEMA","priority":"P1","phaseIntroduced":"PHASE_1","authorityPath":"packages/contracts/schemas/control-api/control-event-notification.schema.json","adrRefs":["ADR-0009"]},{"contractId":"aseos.control-api.control-operation-ref","canonicalName":"ControlOperationRef","domain":"control-api","canonicalOwner":"packages/platform","contractKind":"JSON_SCHEMA","priority":"P1","phaseIntroduced":"PHASE_1","authorityPath":"packages/contracts/schemas/control-api/control-operation-ref.schema.json","adrRefs":["ADR-0009"]},{"contractId":"aseos.evidence.evidence-edge","canonicalName":"EvidenceEdge","domain":"evidence","canonicalOwner":"packages/evidence","contractKind":"JSON_SCHEMA","priority":"P4","phaseIntroduced":"PHASE_5","authorityPath":"packages/contracts/schemas/evidence/evidence-edge.schema.json","adrRefs":[]},{"contractId":"aseos.isolation.isolation-capability-report","canonicalName":"IsolationCapabilityReport","domain":"isolation","canonicalOwner":"packages/contracts","contractKind":"JSON_SCHEMA","priority":"P1","phaseIntroduced":"PHASE_1","authorityPath":"packages/contracts/schemas/isolation/isolation-capability-report.schema.json","adrRefs":["ADR-0010"]},{"contractId":"aseos.isolation.isolation-evidence","canonicalName":"IsolationEvidence","domain":"isolation","canonicalOwner":"packages/evidence","contractKind":"JSON_SCHEMA","priority":"P1","phaseIntroduced":"PHASE_1","authorityPath":"packages/contracts/schemas/isolation/isolation-evidence.schema.json","adrRefs":["ADR-0010"]},{"contractId":"aseos.isolation.isolation-requirement","canonicalName":"IsolationRequirement","domain":"isolation","canonicalOwner":"packages/contracts","contractKind":"JSON_SCHEMA","priority":"P1","phaseIntroduced":"PHASE_1","authorityPath":"packages/contracts/schemas/isolation/isolation-requirement.schema.json","adrRefs":["ADR-0010","ADR-0011"]},{"contractId":"aseos.knowledge.knowledge-query","canonicalName":"KnowledgeQuery","domain":"knowledge","canonicalOwner":"packages/contracts","contractKind":"JSON_SCHEMA","priority":"P4","phaseIntroduced":"PHASE_4","authorityPath":"packages/contracts/schemas/knowledge/knowledge-query.schema.json","adrRefs":["ADR-0004"]},{"contractId":"aseos.knowledge.knowledge-result","canonicalName":"KnowledgeResult","domain":"knowledge","canonicalOwner":"packages/contracts","contractKind":"JSON_SCHEMA","priority":"P4","phaseIntroduced":"PHASE_4","authorityPath":"packages/contracts/schemas/knowledge/knowledge-result.schema.json","adrRefs":["ADR-0004"]},{"contractId":"aseos.learning.causal-experiment","canonicalName":"CausalExperiment","domain":"learning","canonicalOwner":"packages/learning","contractKind":"JSON_SCHEMA","priority":"P4","phaseIntroduced":"PHASE_7","authorityPath":"packages/contracts/schemas/learning/causal-experiment.schema.json","adrRefs":[]},{"contractId":"aseos.learning.learning-gate-decision","canonicalName":"LearningGateDecision","domain":"learning","canonicalOwner":"packages/learning","contractKind":"JSON_SCHEMA","priority":"P4","phaseIntroduced":"PHASE_7","authorityPath":"packages/contracts/schemas/learning/learning-gate-decision.schema.json","adrRefs":[]},{"contractId":"aseos.learning.learning-proposal","canonicalName":"LearningProposal","domain":"learning","canonicalOwner":"packages/learning","contractKind":"JSON_SCHEMA","priority":"P4","phaseIntroduced":"PHASE_7","authorityPath":"packages/contracts/schemas/learning/learning-proposal.schema.json","adrRefs":["ADR-0006"]},{"contractId":"aseos.learning.node-attribution","canonicalName":"NodeAttribution","domain":"learning","canonicalOwner":"packages/learning","contractKind":"JSON_SCHEMA","priority":"P4","phaseIntroduced":"PHASE_7","authorityPath":"packages/contracts/schemas/learning/node-attribution.schema.json","adrRefs":[]},{"contractId":"aseos.learning.root-cause-candidate","canonicalName":"RootCauseCandidate","domain":"learning","canonicalOwner":"packages/learning","contractKind":"JSON_SCHEMA","priority":"P4","phaseIntroduced":"PHASE_7","authorityPath":"packages/contracts/schemas/learning/root-cause-candidate.schema.json","adrRefs":["ADR-0006"]},{"contractId":"aseos.learning.validated-root-cause","canonicalName":"ValidatedRootCause","domain":"learning","canonicalOwner":"packages/learning","contractKind":"JSON_SCHEMA","priority":"P4","phaseIntroduced":"PHASE_7","authorityPath":"packages/contracts/schemas/learning/validated-root-cause.schema.json","adrRefs":[]},{"contractId":"aseos.node.node-definition","canonicalName":"NodeDefinition","domain":"node","canonicalOwner":"packages/node-runtime","contractKind":"JSON_SCHEMA","priority":"P2","phaseIntroduced":"PHASE_2","authorityPath":"packages/contracts/schemas/node/node-definition.schema.json","adrRefs":["ADR-0002"]},{"contractId":"aseos.node.node-execution-record","canonicalName":"NodeExecutionRecord","domain":"node","canonicalOwner":"packages/node-runtime","contractKind":"JSON_SCHEMA","priority":"P2","phaseIntroduced":"PHASE_2","authorityPath":"packages/contracts/schemas/node/node-execution-record.schema.json","adrRefs":["ADR-0002","ADR-0003","ADR-0010","ADR-0011"]},{"contractId":"aseos.node.node-output","canonicalName":"NodeOutput","domain":"node","canonicalOwner":"packages/node-runtime","contractKind":"JSON_SCHEMA","priority":"P3","phaseIntroduced":"PHASE_3","authorityPath":"packages/contracts/schemas/node/node-output.schema.json","adrRefs":["ADR-0002","ADR-0006"]},{"contractId":"aseos.persistence.command-dedup-record","canonicalName":"CommandDedupRecord","domain":"persistence","canonicalOwner":"packages/kernel","contractKind":"JSON_SCHEMA","priority":"P1","phaseIntroduced":"PHASE_1","authorityPath":"packages/contracts/schemas/persistence/command-dedup-record.schema.json","adrRefs":["ADR-0003","ADR-0008","ADR-0009"]},{"contractId":"aseos.persistence.inbox-record","canonicalName":"InboxRecord","domain":"persistence","canonicalOwner":"packages/kernel","contractKind":"JSON_SCHEMA","priority":"P1","phaseIntroduced":"PHASE_1","authorityPath":"packages/contracts/schemas/persistence/inbox-record.schema.json","adrRefs":["ADR-0003","ADR-0008"]},{"contractId":"aseos.persistence.journal-append-batch","canonicalName":"JournalAppendBatch","domain":"persistence","canonicalOwner":"packages/persistence","contractKind":"JSON_SCHEMA","priority":"P1","phaseIntroduced":"PHASE_1","authorityPath":"packages/contracts/schemas/persistence/journal-append-batch.schema.json","adrRefs":["ADR-0008"]},{"contractId":"aseos.persistence.lease-record","canonicalName":"LeaseRecord","domain":"persistence","canonicalOwner":"packages/node-runtime","contractKind":"JSON_SCHEMA","priority":"P2","phaseIntroduced":"PHASE_2","authorityPath":"packages/contracts/schemas/persistence/lease-record.schema.json","adrRefs":["ADR-0003","ADR-0008"]},{"contractId":"aseos.persistence.outbox-record","canonicalName":"OutboxRecord","domain":"persistence","canonicalOwner":"packages/kernel","contractKind":"JSON_SCHEMA","priority":"P1","phaseIntroduced":"PHASE_1","authorityPath":"packages/contracts/schemas/persistence/outbox-record.schema.json","adrRefs":["ADR-0003","ADR-0008"]},{"contractId":"aseos.persistence.persistence-commit-receipt","canonicalName":"PersistenceCommitReceipt","domain":"persistence","canonicalOwner":"packages/persistence","contractKind":"JSON_SCHEMA","priority":"P1","phaseIntroduced":"PHASE_1","authorityPath":"packages/contracts/schemas/persi